Statement,Rating,Full_Analysis
"CBS News and “60 Minutes” “replaced” former Vice President Kamala Harris’ interview answers “with completely different, and far better, answers, taken from another part of the interview.”",False,"President Donald Trump’s monthslong feud with CBS News’ ""60 Minutes"" reignited after the news program released the full, unedited transcript and video of its pre-election interview with then-Vice President Kamala Harris, the 2024 Democratic presidential candidate.

About three weeks after the Oct. 7, 2024, interview aired, TrumpsuedCBS Broadcasting Inc. and CBS Interactive Inc. for $10 billion, claiming the news outlet deceptively edited the ""60 Minutes"" interview to favor Harris. Then, at the end of January, the Federal Communications Commission, led by Trump appointee Brendan Carr,called on CBSto release the unedited transcript and video. CBS News complied,releasing the content publiclyFeb. 5.

In response, TrumppostedFeb. 6 on his social media platform Truth Social that CBS committed ""fraud.""

""CBS and 60 Minutes defrauded the public by doing something which has never, to this extent, been seen before,"" Trumpwrote. ""They 100% removed Kamala’s horrible election changing answers to questions, and replaced them with completely different, and far better, answers, taken from another part of the interview.""

Trump’s statement misrepresents what happened.

Trump is referring to Harris’ answers in two videos CBS News released. In an Oct. 6, 2024,video clippreviewing the interview on the CBS News show ""Face the Nation,"" Harris answered a question about U.S.-Israel relations. The next day, when the ""60 Minutes"" interview aired, itshowedHarris giving a different answer to the same question.

Thefull, unedited interview transcriptshows that CBS News’ ""60 Minutes"" took Harris’ answers in both videos from the same three-and-a-half-minute exchange on U.S.-Israel relations. It does not show that CBS News replaced Harris’ answers on this topic with a response from a different portion of the interview.

It’s typical for news outlets to edit long interviews into shorter broadcast segments or published stories.

Trump backed out of his CBS News ""60 Minutes"" interview before the 2024 election, breaking a decadeslong tradition of major party presidential candidates’ interviews with the network ahead of the general election.

PolitiFact contacted the White House for comment, but received no response.



Because the interview aired on the anniversary of the Oct. 7, 2023, Hamas attack on Israel, ""60 Minutes"" correspondent Bill Whitaker began the interview with questions about Israel and the Biden-Harris administration’s relationship with Israeli Prime Minister Benjamin Netanyahu.

PolitiFact annotated the unedited interview transcript below to show how ""60 Minutes"" presented Harris’ answers in the preview clip and aired interview.

Here’s a guide, followed by the exchange:

Bold:Only in the preview clip.

Italics:Only in the aired interview.

Bold and italics:In both videos.

Unmarked sections: Not included in either video.

Whitaker:""We supply Israel with billions of dollars in military aid.""

Harris:""Mm-hmm.""

Whitaker:""And yet Prime Minister Netanyahu seems to be charting his own course. The Biden administration, the Biden-Harris administration has pressed him to agree to a cease-fire, he's resisted. You urged him not to go into Lebanon, he went in anyway.He has promised to make Iran pay for the missile attack, and that has the potential of expanding the war.Does the U.S. have no sway over Prime Minister Netanyahu?""

Harris:""Well, let’s start with this. On this subject,the aid that we have given Israel allowed Israel to defend itself against 200 ballistic missiles that were just meant to attack the Israelis, and the people of Israel.And I think that is the most recent example of why what we do to assist in their defense around military aid is important.And when we think about the threat that Hamas, Hezbollah presents Iran, I think that it is without any question our imperative to do what we can to allow Israel to defend itself against those kinds of attacks. Now,the work that we do diplomatically with the leadership of Israel is an ongoing pursuit around making clear our principles,which include the need for humanitarian aid, the need for this war to end, the need for a deal to be done which would release the hostages, and create a cease-fire. And we’re not going to stop in terms of putting that pressure on Israel, and in the region,including with other leaders in the region,including Arab leaders.""

Whitaker:""But it seems that Prime Minister Netanyahu is not listening.The Wall Street Journal said that he — that your administration has repeatedly been blindsided by Netanyahu, and in fact, he has rebuffed just about all of your administration’s entreaties.""

Harris:""Well, Bill, the work that we have done has resulted in a number of movements in that region by Israel that were very much prompted by, or a result of many things, including our advocacy for what needs to happen in the region.And we’re not going to stop doing that.We are not going to stop pursuing what is necessary for the United States to be clear about where we stand on the need for this war to end.""

Whitaker:""Just one last thing.Do we have a real close ally in Prime Minister Netanyahu?""

Harris:""I think, with all due respect, the better question is do we have an important alliance between the American people and the Israeli people. And the answer to that question is, ‘Yes.’And we are going to do what is important to support whatever leadership is in Israel, that is defending the security of the State of Israel.""

After this response, Whitaker changed topics to ask Harris why she wanted to be president. The Israel topic arose only once more during the interview, when Harris briefly mentioned Iran’s ballistic missile attack on Israel.

The full, unedited interview video isavailable on ""60 Minutes"" YouTube page. The exchange about U.S.-Israel relations starts about six minutes in.

You can also read the full, unedited interview transcripthere. The exchange about U.S.-Israel relations is on Pages 11-13. Parts highlighted in yellow were included in the preview clip, parts highlighted in blue were in the aired interview and parts highlighted in green were in both videos.



When publishing the transcripts and video the Federal Communications Commission requested, CBS Newssaid in a statementthat the content shows ""the ‘60 Minutes’ broadcast was not doctored or deceitful.""

In its statement, CBS News noted that it’s common practice for journalists to edit interviews for time, space or clarity. The full, unedited interview video is 57 minutes long; that was edited down to 20 minutes.

CBS News said it broadcast a longer portion of Harris’ answer to Whitaker’s question about U.S.-Israel relations in a preview clip and a shorter version of Harris’ answer was included in the aired interview.

The news outlet said it edited the ""60 Minutes"" interview to include as much of Harris’ answers to Whitaker’s questions as possible, while fairly representing the substance of Harris’ answers.

CBS News made a similarstatementOct. 20, 2024, rebutting Trump’s accusation of deceitful editing.

Kelly McBride, senior vice president and chair of Craig Newmark Center for Ethics and Leadership at the Poynter Institute for Media Studies, told PolitiFact that CBS News’ ""60 Minutes"" edited the Harris interview reasonably. (The Poynter Institute owns PolitiFact.)

""I would say that their edits are completely within the standards that journalists employ when they try to create an informative product for the public,"" McBride said. ""It seems very much like what journalists do with all verbose speakers, including and especially Donald Trump.""

Trump posted on Truth Social that CBS News and 60 Minutes ""replaced"" Harris’ ""60 Minutes"" interview answers ""with completely different, and far better, answers, taken from another part of the interview.""

The full, unedited interview transcript does not show that CBS News’ ""60 Minutes"" replaced all of Harris’ answers to questions about U.S.-Israel relations with a response from a different part of the interview. CBS did not change Harris’ meaning.

News outlets commonly edit interviews for length and clarity. CBS News used a longer version of Harris’ response in a video clip previewing the ""60 Minutes"" interview on the CBS News show ""Face the Nation."" It used a shorter excerpt of Harris’ answer in the aired ""60 Minutes"" interview. Both parts of Harris’ answer were taken from the same segment of the interview, the unedited transcript shows.

A media ethics expert said the ""60 Minutes"" interview adhered to typical journalistic standards.

We rate this claim False.

RELATED:Trump claimed Harris’ ‘60 Minutes’ interview violated campaign finance law. That’s False"
"Says Kevin Hassett, National Economic Council director, said on April 7, “Trump is considering a 90-day pause in tariffs for all countries except China.”",False,"Editor’s note:On April 9, President Donald Trumpannounced a 90-day delay for some tariffson all countries, except China, a reversal of his previous stance. On April 7, the White House had dismissed rumors of Trump considering a 90-day pause as ""fake news.""

White House officials never publicly mentioned a 90-day pause of President Donald Trump's tariffs on April 7, but X posts falsely saying they did contributed to a briefmulti-trillion dollarstock market rally.

Verified X accounts that cover markets attributed reports of the supposed pause to National Economic Council Director Kevin Hassett, who had appeared on Fox News that morning. The posts — the first of which was shared at 10:11 a.m. — shared a significantly exaggerated version of Hassett’s response to an interview question about a 90-day pause. That incorrect information was echoed in web headlines and cable outlets that cover the markets.

One larger X account said its post was based on a news headline from an outlet it did not identify. It’s stillunclearwhere that purported headline originated; the markets started climbing at 10:09 a.m., shortly before the first X posts shared the 90-day tariff pause claim.

The rumored tariff reliefboosted the marketafter days of dips since Trump announced across-the-board tariffs on trade partners April 2.

Here’s how the rumor spread before the Trump White House addressed it.

At about 8:30 a.m. E.T., ""Fox & Friends"" host Brian KilmeadeaskedHassett whether the administration would consider a 90-day pause on tariffs.

""Yeah, you know, I think the president is going to decide what the president’s going to decide,"" Hassett said. ""There are more than 50 countries in negotiation with the president. We’ve got the prime minister of Israel coming today. We’ve had a reach out overnight from Taiwan. But I would urge everyone — especially (Bill Ackman) — to ease off the rhetoric a little bit."" (Ackman, a billionaire who endorsed Trump,saidthe president’s policies might trigger a ""self-induced economic nuclear winter."")

The distortion of Hassett’s remarks appeared to start with the X account Hammer Capital at 10:11 a.m.

""Hassett: Trump is considering a 90-day pause in tariffs for all countries except China,"" the accountpostedin all capital letters. Then, in lowercase text: ""Mother of all squeezes incoming.""

Hammer Capital had nearly 700 followers April 7, and the account’s blue check mark shows that its owner is an X Premium subscriber.

Twominuteslater, the ""Walter Bloomberg"" X account shared a red siren emoji andthe samepurported Hassett statement in all capital letters. The anonymous account, with 850,000 followers, primarily postsBloomberg Terminalheadlinesabout the markets. Although it isn’t affiliated with Bloomberg News, TechCrunchreportedit has been considered a reliable source of business news.

A 10:14 a.m.articleon ForexLive, a market news and analysis website, warned that the viral headline’s source was unclear even though the headline was being shared ""everywhere.""

Around the same time, CNBC anchors attempted to explain a sudden market rally.

""Apparently, Hassett’s been saying that Trump will consider a 90-day pause in tariffs for all countries except for China,""saidCNBC anchor Carl Quintanilla.

Jeremy Siegel, a frequent CNBC guest and Wharton School professor emeritus of finance, said: ""Oh, well that’s huge. I mean that changes the game.""

""We’ll try and source that exactly in terms of where that’s coming from,"" CNBC host David Faber said. A few moments later, a CNBC chyron repeated the claim circulating on X. After those initial mentions, CNBC reporters discussing the reported headline repeatedly said that the White House had not confirmed the news.

A CNBC spokesperson said later that as the network reported the market news in real-time, it had aired unconfirmed information in a graphic. Within about 20 minutes of its original report, CNBC’s senior Washington correspondent Eamon Javers made an on-air correction.

Next, Reuters ran a story crediting CNBC. The newswire later withdrew the story, according to anarchived version of the link.

""Reuters, drawing from a headline on CNBC, published a story on April 7 saying White House economic adviser Kevin Hassett had said that President Donald Trump was considering a 90-day tariff pause on all countries except China,"" the storysaid. ""The White House denied the report. Reuters has withdrawn the incorrect report and regrets its error.""

At 10:33 a.m., CNBC’s Javersreportedthat White House Press Secretary Karoline Leavitt told him the 90-day pause chatter was ""fake news.""

By 10:38 a.m., the White House’s Rapid Response 47 X account alsodismissedclaimsof an upcoming 90-day tariff pause.



Wrong. Not only did Director Hassett not say this (clip below),@POTUShas been clear — ""it all has to change, but especially with CHINA!!!""https://t.co/3Kvt8AScAZpic.twitter.com/JHucHjZm3S

Searching Google and the Nexis news database, we found no credible reports the Trump administration publicly considered a 90-day tariff pause.

In response to journalists’ questions on X, the account Hammer Capital did not provide the source of the information in its initial X post. At almost 1 p.m., the accountsaidit had been ""regurgitating what the market was reacting to"" after ""trading desks started sending out this headline at 10:09."" PolitiFact messaged Hammer Capital on X and received no response.

The Walter Bloomberg account owner also did not respond to our email inquiry asking for the source of its post. The account owner toldThe Wall Street Journalthey first saw the headline at 10:09 a.m. Those who run the Walter Bloomberg account founda 10:12 a.m. X postfrom another stock market-focused account and, ""given the market movement,"" determined the headline must be credible and shared it, The Wall Street Journalreported.

For the media, the incident revealed reporting difficulties when facing ""a highly volatile stock market,"" said Jane Kirtley, a University of Minnesota professor of media ethics and law. She said the ""missing piece"" for news organizations was getting a response from the White House before publishing the original stories.

""The White House may not have been immediately forthcoming, but ultimately, news organizations should do everything possible to confirm a rumor — especially one with the implications this one had,"" she said.

X posts say Hassett said, ""Trump is considering a 90-day pause in tariffs for all countries except China.""

The posts appear to have been amplifying a distortion of a noncommittal response Hassett gave on ""Fox & Friends"" to a question about the possibility of a 90-day tariff pause. We found no credible reports that the Trump administration was ever considering a 90-day tariff pause.

The White House responded to a post echoing this claim on X, writing, ""Wrong. Fake News.""

We rate this claim False.

PolitiFact Researcher Caryn Baird contributed to this report.

RELATED:What is a recession, and is it tied to stock market declines? What to know after Trump’s tariffs"
"“Daughter of boxing legend, Muhammed Ali, Laila Ali, has lost her life while giving birth in a Canadian hospital.”",False,"Laila Ali, a retired professional boxer and daughter of the late boxing legend Muhammad Ali, is alive.

But a death hoax about her purported passing spread widely enough online that she felt compelled to correct the record.

""I’m fine, I’m healthy,"" she said in a March 30 videopostedon her verified Facebook page. She then referred to the rumor that’s drawing attention in other Facebook posts.

""Another tragedy has struck the boxing world, as daughter of boxing legend, Muhammed Ali, Laila Ali, has lost her life while giving birth in a Canadian hospital,"" one suchpostsaid. ""This is coming hours after boxing great George Foreman lost his life at 76.""

This Facebook post was flagged as part of Meta’s efforts to combat false news and misinformation on its News Feed. (Read more about ourpartnership with Meta, which owns Facebook, Instagram and Threads.)

The post’s reference to ""another tragedy"" likely is theMarch 21 deathof heavyweight boxing legend George Foreman — who lost his first title to Muhammad Ali. He was 76.

But Laila Ali didn’t die hours later, or at all. And as she noted in her video, she’s not pregnant. She’s 47 and the mother to two teenagers.

We rate claims she died Pants on Fire!"
"In November 2025, actor Alyssa Milano wrote an open letter addressed to U.S. Rep. Marjorie Taylor Greene, R-Ga., criticizing the congresswoman's longstanding support for President Donald Trump, that started: ""Congresswoman Greene, Let’s skip the pleasantries. They were never your thing anyway.""",True,"In late November 2025,socialmediausersclaimed(archivedhere,here,hereandhere) that actor and activist Alyssa Milano wrote an open letter to U.S. Rep. Marjorie Taylor Greene, R-Ga., criticizing the congresswoman's longstanding support for President Donald Trump despite Greene breaking from his administration onseveral issuesin the second half of 2025.
On Nov. 21, Greeneannounced(archived) she wouldresignfrom Congress effective Jan. 5, 2026. Her decisionfollowedapublicfalling-outwithTrump(archived,archived)over his stance on releasing files related to late sex offender Jeffrey Epstein and broader disagreements over foreign affairs and health care policy.
According to the social media posts, Milano's purported letter, dated Nov. 17, began:
Congresswoman Greene, Let's skip the pleasantries. They were never your thing anyway.
So…you've suddenly discovered that Donald Trump, the man you treated like a messiah, is not loyal and that the MAGA movement is not safe, not sane, and certainly not rooted in anything constitutional. And you're shocked that he's attacking you, endangering you, calling you a traitor. As if you didn't know he had it in him. Puh-lease.
Here's the part you don't get to skip:
You helped create this monster. You fed it. You protected it. You celebrated it. And now that it's finally turning on you, you want sympathy? Understanding? A moment of national concern?
No. Absolutely not. NOPE.
Becauselettersandstatementsare sometimes misattributed to public figures, multiple Snopes readers emailed us and searched our website to verify whether the letter was accurately attributed to Milano.
In this instance, the actor did write the letter. Milano posted links to it on her verifiedFacebook(archived) andInstagram(archived) accounts. She published the full letter in aNov. 17 poston her verified Substack (archived) with text that matched what people shared on social media.
In her letter, Milano criticized Greene for what shedescribedas empowering Trump's Make America Great Again movement and then objecting when she became a target. She alsoarguedthat Greene's call to release the Epstein files was driven by ""fear"" rather than ""courage.""
Milanoconcludedthe letter by calling for Greene's ""public, unequivocal accountability"" if she wants ""redemption,"" writing that ""real accountability means going fully public with everything you know, every lie, every scheme, every threat, every abuse of power you witnessed, tolerated, or assisted.""
The full text of Milano's open letter was as follows (emphasis hers):
Congresswoman Greene,
Let's skip the pleasantries. They were never your thing anyway.
So…you've suddenly discovered that Donald Trump, the man you treated like a messiah, is not loyal and that the MAGA movement is not safe, not sane, and certainly not rooted in anything constitutional. And you're shocked that he's attacking you, endangering you, calling you a traitor. As if you didn't know he had it in him. Puh-lease.
Here's the part you don't get to skip:
You helped create this monster. You fed it. You protected it. You celebrated it. And now that it's finally turning on you, you want sympathy? Understanding? A moment of national concern?
No. Absolutely not. NOPE.
You don't get to unleash political poison into the bloodstream of American politics and then act surprised when it reaches your own veins. You don't get to cheer on Trump while he smears, threatens, and dehumanizes everyone in his way, and then clutch your fake pearls when he finally does it to you. You don't get to empower a movement built on conspiracy, cruelty, and violence, and then cry foul when you become its latest target.
Let's be honest, you calling for the release of the Epstein Files, isn't courage. It's fear. You don't suddenly care about truth or justice. And you definitely don't care about the victims. You are calling for the release of the files because you're afraid of what unchecked power looks like when it's no longer aimed at your enemies. The Epstein case is a perfect cultural lightning-rod and your supporters love that shit. You saw the polls and are reacting accordingly. Jump off the sinking MAGA ship, am I right, MTG?
Now you're talking about accountability and transparency. Ha! Where was that energy on January 6th? Where was your outrage when Trump incited a mob to storm the Capitol? When they hunted Democratic lawmakers through hallways? When they called for the hanging of the Vice President? When police officers were beaten, crushed, and traumatized doing their jobs?
Where was your moral clarity then, MTG?
Where was your voice when Democratic governors were receiving kidnapping threats? When election workers were doxxed and terrorized? When a man broke into Nancy Pelosi's home with a hammer and nearly killed her husband? When threats against Democrats, judges, school boards, and public servants skyrocketed?
You said nothing.
And this isn't new behavior. You chased a Parkland school-shooting survivor, David Hogg, down a Washington sidewalk, taunting him and calling him a ""coward."" You screamed through President Biden's State of the Union address like you were the most unprofessional person to ever be elected into office.You voted against the Frederick Douglass Human Trafficking Prevention and Protection Reauthorization Act, (one of only twenty members of Congress to oppose a bipartisan bill designed to help trafficking victims).
You amplified QAnon conspiracies. You suggested school shootings were staged. And while Democrats were being targeted, when a militia plotted to kidnap Governor Gretchen Whitmer, and when Governor Josh Shapiro's home was set on fire in an arson attack with his family inside, you offered no outrage, no sympathy, no defense of democracy.
I could go on. But I think you get the picture, Congresswomen. I'm not buying it.
If you want redemption. If you want to step into the light, there is only one door:
Public, unequivocal accountability. Not the performative kind with hair and make-up. Not the ""Trump hurt my feelings"" kind. Not the victimhood you've perfected. Real accountability means going fully public with everything you know, every lie, every scheme, every threat, every abuse of power you witnessed, tolerated, or assisted. If you want redemption, start with the truth. All of it.
Until then, this isn't a moral awakening. It's simply the consequences of your own choices arriving right on schedule.
Sincerely,
Alyssa Milano
Snopes contacted Greene's office for comment on the open letter and will update this story if we receive a response.
Milano has openly criticized Republican politicians— particularly Trump — and their supporters for years. In January 2019, itwaswidelyreportedthat she posted a message on X (then Twitter) comparing the MAGA hat to the hood worn by members of the Ku Klux Klan. Thealleged tweethad been deleted or removed at the time of publication (Milanoreportedlydeactivatedher X account in late 2024).
For further reading, we alsounpackeda claim that Greene wanted to run for president in 2028— a rumor that she rejected as ""baseless gossip."""
