Statement,Rating,Full_Analysis
Pharmaceutical companies behind weight loss and diabetes medication such as Ozempic are facing a lawsuit that could potentially pay out more than $2 billion.,True,"There is multidistrict litigation, or an MDL, in progress against pharmaceutical companies Novo Nordisk and Eli Lilly and Co. from parties allegedly suffering side effects caused by the active ingredient in Ozempic and other similar drugs used for type 2 diabetes and weight loss.
There is no public evidence that the potential payout could be more than $2 billion. Reports featuring these numbers cite unnamed analysts but offer no documentation arriving at this number. A number of lawsuits are continuing to be filed under the MDL, which will mean the ultimate payout amount is in flux until all cases are settled. As of August 2025, there were more than 2,600 cases, with the number expected to grow.
A rumor that pharmaceutical companies behind popular weight-loss and diabetes medications like Ozempic faced lawsuits totaling more than $2 billion circulated online in August 2025.
The claim was spread by users across social media platforms such asFacebook(archived)andX(archived,archived), with some sharing a June 2025 advisory from theWorld Health Organizationthat declared some of these medications could lead to a condition that is the ""leading cause of vision loss in adults and the second most common optic neuropathy after glaucoma.""
Though the alleged lawsuit included a variety of drugs that serve similar purposes, Ozempic was the most widely mentioned due itspopularity. According to itswebsite, ""Ozempic is a medicine for adults with type 2 diabetes that, along with diet and exercise, may improve blood sugar. While not for weight loss, Ozempic may help you lose some weight."" The drug was first approved for use by theFederal Drug Administrationin 2017.
Claims of lawsuits against Ozempic and similar drugs are indeed true. However, there is no publicly available evidence regarding the potential settlement amounts. Therefore, we have rated this claim as mostly true until we can determine the amount of money involved.
Novo Nordisk, the manufacturer of Ozempic, Wegovy and Rybelsus, as well as Eli Lilly and Co., which manufactures Trulicity and Mounjaro, faced several personal-injury lawsuits based on alleged side effects caused by GLP-1 agonists. GLP-1 agonists are drugs ""used to treat type 2 diabetes and support weight loss by mimicking the GLP-1 hormone,"" according toDrugs.com.
The Novo Nordisk products use a GLP-1 calledsemaglutide(used in Ozempic, Wegovy and Rybelsus) while the Eli Lilly drugs use GLP-1s calleddulaglutideandtirzepatide(used in Trulicity and Mounjaro, respectively). Because of their similarities, the lawsuits were collected under a multidistrict litigation. MDLs are commonly used for complex cases with similar complaints from a multitude of claimants, such as claims related to health issues caused byasbestos products.
According to theEastern District of Pennsylvania, whose Judge Karen Spencer Marston is overseeing the Ozempic case, an MDL is ""litigation comprised of multiple civil cases involving one or more common questions of fact, but the cases are pending in different districts. Such actions may be transferred to any single district for coordinated or consolidated pretrial proceedings.""
Very basically, this means a judge can make a single ruling that can then apply to other cases included in the MDL.
The U.S. Judicial Panel on Multidistrict Litigation, the body that decides whether cases should be reclassified in such a manner,saidof its decision to classify the case as an MDL:
Each lawsuit contains substantially similar allegations about GLP-1 RAs (specifically, Ozempic, Wegovy, Rybelsus, Trulicity, and/or Mounjaro) and their alleged propensity to cause gastrointestinal injuries … [and] [a]ll actions share common issues of fact regarding whether defendants knew or should have known that their GLP-1 RA products can cause gastroparesis and other gastrointestinal injuries, whether defendants adequately warned plaintiffs or their prescribing physicians about the alleged dangers of these products, and whether defendants made false, misleading, or incomplete representations regarding the safety of these products.
According to the websiteLawsuit Tracker, as of August 2025 the GLP-1 multidistrict litigation, also referred to asMDL 3094, was in its early stages, with people still filing lawsuits.
This is likely the reasonGoogle searchesfor ""Ozempic lawsuit"" primarily return results from personal-injury law firms making the case known to potential clients, hoping to attract others to join the lawsuit and ultimately earn the firms a payout.
For instance, in addition to gastrointestinal injuries, one personal injury law firm pointed out arecent studythat also linked ""a serious eye injury known as non-arteritic anterior ischemic optic neuropathy,"" known as NAION, to the drug. The same law firm alsoposted:
You may qualify to file a claim if:
-You were prescribed Ozempic, Wegovy, Rybelsus, or Mounjaro
-You experienced gastroparesis, ileus, gallbladder disease, vision loss, or other serious complications
-You have medical records confirming diagnosis and treatment
-You have not signed a liability waiver or accepted prior compensation
Even if your symptoms resolved, you may still be eligible based on pain, suffering, and medical costs incurred.
The officialOzempic websitelisted a variety of possible side effects from the medication, including ""changes in vision,"" ""severe stomach problems"" and ""dehydration leading to kidney problems,"" while adding, ""the most common side effects of Ozempic may include nausea, vomiting, diarrhea, stomach (abdominal) pain, and constipation.""
A Novo Nordisk spokesperson told Snopes via email:
Semaglutide has been extensively examined in robust clinical development programs, large real-world-evidence studies and has cumulatively over 33 million patient years of exposure. Semaglutide's efficacy and safety have been extensively demonstrated in people with obesity/overweight with robust evidence for improving health outcomes. Semaglutide has demonstrated improvements in CV death, stroke and myocardial infarction.
Novo Nordisk believes that the allegations in the lawsuits are without merit, and we intend to vigorously defend against these claims. Patient safety is our top priority at Novo Nordisk, and we work closely with the U.S. Food and Drug Administration to continuously monitor the safety profile of our medicines. Novo Nordisk remains confident in the benefit-risk profile of our GLP-1 medicines, when used consistent with their indications and product labeling.
A spokesperson for Eli Lilly old Snopes via email, ""This week, the MDL Court issued an opinion excluding plaintiffs' experts. Lilly appreciates the Court's careful consideration of threshold issues related to the diagnosis of gastroparesis and the need for reliable science to support plaintiffs' claims. We will continue to vigorously defend against these lawsuits.""
Indeed, in a memorandum issued Aug. 15, 2025, the court ruled that two experts cited by the plaintiffs were to be excluded from the proceedings. However, the court also agreed to the plaintiff's motion to supplement, which means additional evidence may be added in support of the claimants. The memorandum noted:
The Court recognizes that given this ruling, some Plaintiffs in this MDL will be unable to prove that they suffered from gastroparesis because their diagnosis was not based on a properly performed gastric emptying study. Although unfortunate, it would be perhaps more unjust to hold Defendants potentially liable for damages based on an unreliable diagnosis. For that reason, courts in other cases have rejected similar claims where the plaintiffs were unable to prove the cause of their illness because their treating physician failed to perform a necessary test at the time of diagnosis.
The memorandum also noted these decisions ""will have relatively little effect on the vast majority of the cases in this MDL.""
As for the amount of damages at stake in the litigation, the $2 billion figure appeared to originate with the law firm of Melinda J. Helbock, whosewebsitestated ""analysts project total liability could exceed $2 billion as new claims surge."" The website did not give more information about the analysts or how they arrived at that number.
However, there is no public evidence that this number is accurate. When asked about the potential amount at stake in the MDL, a law clerk for presiding U.S. District Judge Karen Marston told Snopes in an email, ""It is Judge Marston's policy not to comment on pending cases, whether it be specific inquiries or more general inquiries.""
It is unlikely an accurate figure will be available until the MDL is concluded, which could potentially take years.
In conclusion, while the lawsuit brought against Ozempic and similar drugs is authentic, there is no evidence of what the potential windfall could be should the plaintiffs succeed."
"On Aug. 25, 2025, U.S. President Donald Trump's Deputy Chief of Staff for Policy Stephen Miller called the Democratic Party a ""domestic, extremist organization"" on Fox News.",True,"On Aug. 25, 2025,according to postson social media, U.S. President Donald Trump's Deputy Chief of Staff Stephen Miller called the Democratic party a ""domestic, extremist organization"" on live television.
Using such language to describe the opposition party to the current presidential administrationstartled many online,some of whom called Miller'srhetoric ""fascist.""Snopes readers searched the site wondering if Miller had indeed said those words.
He did. The claim is true.
Miller appeared on Fox News' ""Hannity"" to talk about ""how Democrats have let crime run rampant in Chicago,""according to a Fox News clip of his comments. (According toChicago's NBC affiliate WMAQ, Chicago Police Department statistics show the city saw a 21.9% decrease in violent crime in 2024).
The appearance followed Trump'sAug. 11 decisionto station national guard troops in Washington, D.C., in order to, as he said, decrease crime andcomments suggestingthat Chicagoand other cities with mayors from the Democratic party might follow.
Hannity introduced Miller with the following remarks:
You know Steven, I've been running a scroll of the names of people that have been shot and shot and killed. You could predict with pinpoint accuracy how many people on any given weekend are going to be shot and shot and killed in Chicago. They haven't lifted a finger to solve the problem.
You know, they've fallen in to this ""defund,"" ""dismantle,"" ""reimagine,"" ""no-bail"" insanity. And now Donald Trump wants to help and they're mad at him?
Over a chyron that read ""Dems fall on the wrong side of every issue,"" Miller responded as follows (emphasis added):
Look, we discussed this last time I was on your show. The Democrat party does not fight for, care about or represent American citizens. It is an entity devoted exclusively to the defense of hardened criminals, gangbangers, and illegal alien killers and terrorists.The Democrat party is not a political party. It is a domestic, extremist organization.
Look at Chicago. They've shut down the police department, they've handcuffed law enforcement, and as President Trump says, they have turned the streets of Chicago into a bloody killing field.
Here in Washington, D.C., before President Trump launched the federal law enforcement liberation in D.C., there was a murder on the streets of this town every other day — body after body after body after body. That was Washington, D.C. Residents were afraid to go to restaurants, they were afraid to go into entire neighborhoods, they were getting carjacked right and left, robbed and beaten. That was Washington, D.C.
Now we're two weeks homicide free — the safest the city has ever been in its entire history. And the Democrats, instead of jumping up and down and saying, ""Thank you President Trump, thank you for saving our lives, thank you for saving our cities, thank you for scrubbing away all the graffiti, the trash, the homeless encampments, the druggies"" — instead of cleaning up the city, instead of thanking him for that, they're saying, ""President Trump, how dare you save our lives, how dare you save our children, how dare you save our city.""
The Democrat party, Sean, that exists today, it disgusts me. I do not recognize that party, Sean.
In Trump's first administration,Millerserved as a senior policy adviser and speechwriter.According to The Guardian, he was the architect behind several of Trump's ""most notorious policy initiatives,"" including the ""Muslim ban"" on travelers from seven Muslim-majority countries in 2017. As of this writing, he serves as Trump's deputy chief of staff of policy andhomeland security adviser."
U.S. President Donald Trump once said the U.S. and Italy have been allies since ancient Rome.,False,"In early September 2025, aclaimspreadonsocial mediathat U.S. President Donald Trump once said the U.S. and Italy have been allies since ancient Rome.
One Facebookpost(archived), for example, attracted thousands of comments and reactions, with the caption, ""Trump said that the United States and Italy have been allies since the time of Ancient Rome. Translator's reaction is priceless!""
Numerous social mediaaccountshave spread the claim over years, on platforms such asX,LinkedIn,Threads,Instagram,YouTubeandFacebook.
In short, Trump did not claim that the United States and Italy have been allies since ancient Rome. He remarked that the two countries have a ""shared cultural and political heritage"" dating back back thousands of years. As such, we have rated this claim as false.
We previouslydebunked this rumor back in 2019and2024, highlighting that such an assertion would obviously be incorrect, as the United States was not founded as anindependent nation until 1776, and Italy did not achieveunificationuntil the 19th century, becoming a republic only in the 1940s.
The claim originated from a speech Trump gave during ajoint press conferencewith Italian President Sergio Mattarella on Oct. 16, 2019. During the event, Trump made the following statement: ""The United States and Italy are bound together by a shared cultural and political heritage dating back thousands of years, to ancient Rome.""
Right after that, Trump stated: ""Over the centuries the Italian people have blessed our civilization with magnificent work of art, science, philosophy, architecture, music."" He continued: ""On Monday we pay tribute to the Italian explorer who led a voyage of discovery to the New World, a gentleman known as Christopher Columbus. And to me it will always be called Columbus Day. Some people don't like that, I do.""
Therefore, Trump stated that the United States and Italy share a political and cultural heritage dating back thousands of years, but did not claim they had been allied for that long. Trump's use of the phrase ""dating back thousands of years"" seems to have caused confusion, leading some to misinterpret his remarks.
The influence of the Roman Republic on the formation and principles of the American Republic iswell-documented, making Trump's point historically accurate.
Moreover, the images shared in posts spreading the false claim, allegedly showing ""the translator's reaction,"" were not taken during Trump's misinterpreted comments about Italy. Instead, they were captured that same day in a different location — at theOval Officeof the White House.
For instance, one photo appeared to be a screenshot from the video titled ""OVAL OFFICE: President Trump FULL Meeting With Italian President""sharedon Oct. 16, 2019, by LiveNOW from FOX YouTube channel:
The image circulating in 2025 appeared to be a digitally enhanced remake of anolder collage, with noticeably smoother textures and exaggerated facial features, as shown in the image below:
(X user @OlenaRohoza, Facebook page Sarcasm)
Below you can see a photograph of the scene we accessed viaGetty Images:
(Getty Images)
Its description read:
WASHINGTON, DC - OCTOBER 16: U.S. President Donald Trump meets with President Sergio Mattarella of Italy in the Oval Office of the White House October 16, 2019 in Washington, DC. President Trump is holding talks with President Mattarella on bilateral issues including ""common security challenges and shared economic prosperity."" (Photo by Alex Wong/Getty Images)
Shortly after the event, Mattarella's interpreter,Elisabetta Savigni Ullmann,sparked controversywith many social media usersspeculatingabout her expressions.
In October 2019, wedebunked an adjacent rumor claiming that Trump called Italy's president ""Mozzarella."""
A study published in October 2025 found that vaping products contained bacteria that indicated fecal contamination.,True,"The study looked into a specific sample of vaping products in Virginia schools during the 2024-25 school year. It found some of the devices contained traces of coliform - a bacteria that indicates fecal matter contamination. However, these were devices ""that had been confiscated or found on school premises,"" not new, unopened vapes. This indicated that contamination was due to the product’s handling and storage. The researchers behind the study confirmed via email that no contamination was found in the unopened products they tested.
In fall 2025, a rumor circulated online that scientists found fecal contamination in vaping products during a study published in October.
Grossed-out social media userson X(archived),Facebook(archived) andInstagram(archived) shared the alleged revelation, with onesaying: ""In other words, vape users are literally inhaling toilet microbes — plus nicotine and drug-like additives."" The X user added:
Scientists found fecal contamination and E. coli in vapes.
American researchers examined nearly 1,300 vapes taken from school students in Virginia. Their goal was to show young people what they are actually inhaling.
Most devices contained nicotine, and some had cannabinoids, often a mix of synthetic and plant-based compounds.
But the most disgusting and dangerous part: several vapes contained bacteria, yeast, and E. coli, indicating fecal contamination. In some cases, the levels exceeded safe limits.
A post shared by Success Addictives (@successaddictives)
While it was true that scientists found fecal contamination in vapes, some of the social media users omitted critical context, such as how many devices were contaminated and whether the products were used or unused.
Below we outline the study and provide the crucial details about the fecal findings:
On Oct. 30, 2025,Virginia Commonwealth University published an article saying its forensic toxicology research lab carried outthe study in question. It analyzed a specific sample of ""nearly 1,300 products[collected] from K-12 schools in Virginia""during the 2024-25 school year""as part of a project that exposes the ingredients in thousands of unregulated vapes and cannabis products.""
The team foundthat ""microbiologicals, such as bacteria, yeast"" andcoliform— a bacteria that indicates fecal matter contamination — were present in some of the devices tested,many of which exceeded ""the exposure threshold — meaning that they rise above the level of exposure at which health effects are likely to occur, raising significant concerns about the potential side effects from vaping on user health.""
ProfessorMichelle Peace, one of the VCU researchers who conducted the study, echoed this via email, adding: ""Coliform is a large class of bacteria known to be present in the small intestines of mammals."" She said its presence ""is used to indicate some contamination with fecal matter and the risk that a more serious bacterial pathogen, such as E.coli, could be present. Inhaling coliform and other bacteria can lead to inflamed lung tissue and pneumonia.""
However, Peace said the devices tested ""had been confiscated or found on school premises"" and therefore were not new, unopened vaping products.While vapes can contain other unhealthy chemicals like nicotine, she noted: ""When we assessed a small number of products we purchased ourselves and sampled immediately after opening, no vapes were contaminated.""
This indicated that contamination was due to the products' handling and storage.According to Peace, given that some of the devices were contaminated, ""consumers need to be thoughtful about where and how they store/keep their devices and washing their hands after using the bathroom.""
""The reason is that people do not wash their hands or wash them well before they handle something else,"" she continued. ""Additionally, vapes are carried in back pockets, where they may remain while someone uses the bathroom. Many vapes we have received from school systems are also found in the bathrooms, behind and in toilets, in the toilet paper dispenser, in garbage cans, above the ceiling panels.""
""These locations are going to be full of coliform, which can potentially transfer to the vaping device, which is, itself, sticky,"" Peace added, before saying that ""any count of coliform colonies in an inhaled product is considered a failed test.The U.S. Pharmacopeia, General Chapter <1111>, requires an absence of bile-tolerant, gram negative bacteria, which includes coliform. No amount of coliform is allowed in inhaled products.""
So while it was true that contaminants indicating the presence of fecal matter were found in some vaping products during the research, the study itself highlighted the contaminants that were present due to the handling of the products, rather than those present at the time of purchase.
For further reading on finding bacteria in unexpected places, Snopes previously investigated the claim thatcellphones are dirtier than toilet seats. In sum, wash your hands and do not take products you put in or near your mouth into the bathroom."
"Conservative activist Charlie Kirk once described Kyle Rittenhouse, a teenager acquitted of killing two people and wounding another during a protest in Kenosha, Wisconsin, as ""a hero to millions.”",True,"Kirk introduced Rittenhouse during a panel, titled, “Kenosha on Camera,” at “AmericaFest 2021,” an event put on by Turning Point USA, an organization Kirk co-founded. The panel featuring the quote in question took place on Dec. 20, 2021.
In the days following the assassination of Turning Point USA co-founderCharlie Kirkin early September 2025, social media exploded with rumors about the late conservative activist, including purported quotes.
One such claim circulating across social media sites likeInstagram(archived),X(archived), andparticularlyonFacebook(archived,archived,archived), was that Kirk once introduced Kyle Rittenhouse at a Turning Point USA event as ""a hero to millions."" Many of the posts sharing the rumor also included alleged photos of the two men together.
Rittenhouse was an Illinois teenager who waschargedwith, and lateracquittedof, homicide and reckless endangerment after hefatally shottwo people and wounded another duringa Black Lives Matter protest in Kenosha, Wisconsin, on Aug, 25, 2020.
The quote is correctly attributed to Kirk. He introduced Rittenhouse at a panel, titled, ""Kenosha on Camera,"" on Dec. 20, 2021, at a Turning Point USA event called ""AmericaFest 2021.""
Following Kirk's introduction and the crowd chanting Rittenhouse's name, Kirk said:
Kyle, I just got to say that what you went through, where they tried to destroy your life, the media tried to destroy you, the current president right now called you a white supremacist … and Kyle, the way you held it all together, you're a hero to millions and and it's an honor to be able to have you here.
Snopespreviouslyfact-checked the ""white supremacist"" comment Kirk alluded to in this statement and found it to be mostly true.
Videos of the ""Kenosha on Camera"" panel are available on YouTube from a variety of users and attendees, all showing anidenticalsequenceofeventsfrom different angles. On the same date, a user onX(archived) posted a behind-the-scenes moment of Rittenhouse as he prepared to be called out on stage by Kirk.
In the video below, the quote in question begins at 1:35.
Further,Rittenhouse's acquittalhad dominated headlines a month prior to ""AmericaFest 2021,"" and journalists covered his appearance at the event extensively.
For instance,Rolling Stone,SalonandEsquireran Op-Ed pieces about conservatives' ""lionizing"" of Rittenhouse.The Washington Post,Newsweek,The Guardian,the New York Postand local Arizona outletAZ Centralreported on Rittenhouse's appearance and warm reception at the event.
Snopes has fact-checked a variety of claims surrounding Kirk after he wasfatally shotin Utah on Sept. 10, 2025.
For example, we've looked into rumors that he allegedly oncesaidif he had a 10-year-old daughter who became pregnant after being raped he'd want her to deliver the baby, that hecalledMartin Luther King Jr. ""an awful person"" and that hesaidgay people should be stoned to death."
