Statement,Rating,Full_Analysis
"Images authentically depict Immigration and Customs Enforcement agent balloons chasing a balloon of children's cartoon character Dora the Explorer during the Macy's Thanksgiving Day Parade on Nov. 27, 2025.",False,"Following the annual Macy's Thanksgiving Day Parade in New York on Nov. 27, 2025, posts containing images that appeared to depict balloons of Immigration and Customs Enforcement agents chasing a balloon of cartoon character Dora — the star of the children's Spanish language-learning show ""Dora the Explorer"" — gained traction online.
The images spread on multiple platforms, includingFacebook(archived),Instagram(archived)and X(archived). The earliest version of such an image we found was in a Nov. 27Reddit post(archived):
In a truly unexpected turn of events, spectators at this year's Macy's Thanksgiving Day Parade were treated to a live-action pursuit as the beloved Dora the Explorer balloon appeared to be making a hasty retreat from a fleet of what eyewitnesses described as 'highly motivated, slightly deflated' ICE agent balloons. When asked for comment, a spokesperson for Nickelodeon simply stated, 'Dora is always exploring new routes.' Sources close to the parade committee suggest the ICE balloons may have simply been trying to ask Dora for directions to the nearest hot dog stand, but communication was lost somewhere over Herald Square. #MacyParade #DoraTheExplorer #ThanksgivingChaos
Breaking News: Dora The Explorer Balloon Leads ICE Agent Balloons on low-altitude chase Down 6th Avenue.byu/RastrickinPoliticalMemes
This image was generated with artificial intelligence. A Google reverse image search revealed only related posts, anda Google searchof the keywords ""Dora and ICE agents Macy's Thanksgiving Day Parade 2025"" revealed only similar AI-generated images or legitimate news related to an actual Dora balloon featured in the Macy's parade. No credible reports described ICE agent balloons chasing a Dora balloon.
Additionally, we reached out to Macy's seeking comment on the images circulating online, and the company responded: ""The photos depicted in these social posts are not real.""
AI-detection software Hive found the image to be 100% AI-generated. (Software used to detect AI-generated content is not always accurate, and its results should be considered with caution.) The image also contained visual evidence of AI-generation; for example, Dora's left hand had only four fingers.
Following this Reddit post, versions of the same claim with slight variations spread online. One image showedthree officers behind the Dora ballooninstead of two, another depictedonly one officerand in another, the user may havedigitally edited a real imageso an ICE officer balloon appeared behind the image of the authentic Dora balloon.
Authentic Getty imagesshow there was a Dora balloon featured in the 2025 Macy's parade, though characters from the cartoon ""SpongeBob SquarePants"" followed the Dora balloon — not ICE agents.
(Getty Images)
In sum, there was no evidence the 2025 Macy's Thanksgiving Day Parade featured ICE agent balloons chasing a Dora balloon. The images widely circulated display evidence of AI-generation, Macy's said the images weren't real, and no credible reports indicated the events unfolded as described."
"Conservative activist Charlie Kirk's final words before being fatally shot were: ""Counting or not counting gang violence?""",True,"Kirk was answering a question about mass shootings during a debate with an attendee during an event at a Utah college right before he was shot Sept. 10, 2025.
On Sept. 10, 2025, conservative activist Charlie Kirkdied at 31after being shot at a Utah Valley University event — andsocialmediauserssoon began spreading what they claimed were his last words before the shooting.
Manyofthesepostsclaimed Kirk's last words were ""gang violence"" or ""counting or not counting gang violence?""
These posts accurately described Kirk's last words before the shooting, based on Snopes' review ofmultiplevideos, taken from different angles, of Kirk in his final moments. Thus, we have rated this a correct attribution. Here's what Kirk said right before he was shot:
ATTENDEE: Do you know how many transgender Americans have been mass shooters over the last 10 years?
KIRK: Too many. [Applause]
ATTENDEE: In America, it's five. Now, five is a lot, right, I'm going to give you — I'm going to give you some credit. Do you know how many mass shooters there have been in America over the last 10 years?
KIRK: Counting or not counting gang violence?
NBC News also posteda videoof Kirk's last words, ending the footage before the shooting.
Snopes has previouslydebunkedclaims that mass shooters are disproportionately trans people. We alsoinvestigated a claimthat Kirk once said some deaths by gun violence were ""worth it"" in order to have the Second Amendment."
"“As a Californian, we have given more to the recovery of other states than any other state in the union.”",True,"As Californians assess the damages and recovery costs from widespread wildfires in greater Los Angeles, lawmakers and President Donald Trump are floating ideas for overhauling the Federal Emergency Management Agency.

Trump has suggested eliminating the agency, something that would require congressional action. Heordereda council form to review the agency and deliver a report in six months. House Speaker Mike Johnson, R-La., said Congress may want to attachconditions, such as a debt limit increase, to California aid.

That’s a ""shameful"" idea, Sen. Adam Schiff, D-Calif., said Jan. 26 onNBC’s ""Meet the Press.""

Schiff said Congress should not tie unrelated policy objectives to aid or view disaster aid requests through a partisan lens.

""And let me say this, as a Californian, we have given more to the recovery of other states than any other state in the union,"" Schiff said.

Responding to Johnson’s comments calling the idea of conditioning California aid ""a common-sense notion,"" U.S. Sen. Alex Padilla, D-Calif., echoed Schiff’s sentiment.

""California is the largest contributor of tax revenue to the federal treasury by far,"" Padilla wroteJan. 27 on X. ""In 2022 alone, California paid $83 billion more to the federal government than it received. Louisiana took $34.5 billion more federal dollars than it paid. Who is subsidizing whom here?""

We heard similar statements during Trump’s first presidency that California is a""donor"" state– sending more money to the federal government than it gets in return. We found that Schiff cited a credible academic analysis, which requires some explanation.

How a policy group calculates states’ ‘balance of payments’

A Schiff spokesperson citedanalysisfrom the Rockefeller Institute of Government, a public policy arm of the State University of New York.

For several years, the institute hasexaminedthe amount of federal taxes paid by each state’s residents and businesses compared with the amount of federal funding the state receives. The institute refers to the difference of those two numbers as the state’s ""balance of payments"" — a phrase used by Sen. Daniel Patrick Moynihan, D-N.Y. who was elected to the Senate in 1976 and served 24 years.

The institute’s most recentanalysis, published in 2024, showed that California’s balance of payments was greater than any other state in the nation.

California paid $83.1 billion more in federal taxes than it received from the federal government — a difference greater than any other state when measured in sheer dollars.

The state remained a standout when its population was considered, but it didn’t lead all states. The analysis showed that per capita, Californians paid $2,129 more in federal taxes than they received — that’s more than all but three other states.



So, Schiff was right that California’s federal funding contributions far outweigh what it gets from the federal government in return, but the disaster aid comparison is not as much of a straight line.

""The federal government does not have a separate, dedicated revenue stream exclusively for disaster aid,"" said Joel Tirado, an institute spokesperson. ""FEMA funding comes from general revenue aggregated nationally. So, it isn’t possible to know how much of California’s taxes go to disaster relief specifically.""

Jared Walczak, vice president of state projects at the Tax Foundation, a center-right think tank, said policymakers in states such as California sometimes object that their taxpayers are subsidizing other states' taxpayers. But taxpayers are not being treated differently from one state to another. Low-income and high-income taxpayers will receive the same treatment whether they live in California, Nebraska or Arkansas, Walczak said.

""The difference is that California has more high earners than other states, and under a progressive tax and transfer system, high earners face progressively higher tax burdens which serve, in part, to fund programs that benefit lower-income households,"" Walczak said. ""It's not that Californians are subsidizing Arkansans: it's that high earners in California and Arkansas and everywhere else face higher tax burdens than low earners in California and Arkansas and everywhere else.""

Joshua Sewell, research and policy director at Taxpayers for Common Sense, a nonpartisan taxpayer advocacy group, said he agreed with Schiff’s general point because California’s economy and its contributions to federal revenues exceed every other state.

""That’s because federal lawmakers have taken those commingled funds generated from the income tax, customs duties, and excise taxes and redistributed them through federal programs,"" Sewell said.

Brad Franklin, a research fellow at the Public Policy Institute of California, a nonpartisan think tank, said disaster response programs are implemented by many agencies and departments, which receive most of their funding fromsupplemental appropriations.

""That money ultimately comes from tax receipts, and California definitely pays more than its share,"" Franklin said. ""Putting things in per capita terms, as (the Rockefeller report) did, is helpful for thinking about tax burden per person. But total receipts are much more relevant to this question.""

Schiff said, ""As a Californian, we have given more to the recovery of other states than any other state in the union.""

Schiff was citing the Rockefeller Institute of Government’s analysis of 2022 data. It showed California paid $83 billion to the federal government more than it received. This is not surprising since California is the most populous state. When that difference is calculated per capita, however, the figures showed that, compared with California, three other states paid more to the federal government than they received.

We rate this statement Mostly True.

RELATED:Republican leaders want to put conditions on California wildfire aid. Is there precedent for that?

"
"U.S. Vice President JD Vance once called President Donald Trump ""America's Hitler.""",True,"In 2016, Vance wrote in a private message to his former law school roommate: ""I go back and forth between thinking Trump is a cynical a**hole like Nixon who wouldn't be that bad (and might even prove useful) or that he's America's Hitler. How's that for discouraging?""
In September 2025, internet users recirculated a years-old claim that U.S. Vice President JD Vance once called President Donald Trump ""America's Hitler.""
The claim resurfaced shortly after a group of pro-Palestine activistsheckledTrump at a Washington, D.C., restaurant on Sept. 9. As wordspreadthat the protesters' chants included the line ""Trump is the Hitler of our time,"" some social media users said Trump's vice president once made the same comparison.
Posts including the claim appeared inmultiple(archived) postson X(archived). For example, one user wrote:
""Trump is the Hitler of our time."" Brilliant.
Fun Fact: JD Vance also called Trump ""America's Hitler""
I hope convicted felon Donald Trump is reminded of this every time he's in public.
""Trump is the Hitler of our time."" Brilliant.Fun Fact: JD Vance also called Trump ""America's Hitler""I hope convicted felon Donald Trump is reminded of this every time he's in public.
— Alex Cole (@acnewsitics)September 10, 2025
The claim was true. In a 2016 textmessageto his former law school roommate, Vance wrote: ""I go back and forth between thinking Trump is a cynical a**hole like Nixon who wouldn't be that bad (and might even prove useful) or that he's America's Hitler. How's that for discouraging?""
The recipient of the message — Josh McLaurin, now a Democratic state senator in Georgia — made the text message publicin 2022, and several reputable news outlets corroborated its legitimacy at that time. Since then, Vance has acknowledged his past remark comparing Trump to ""America's Hitler,"" stressing his views on the former president have changed.
For instance, in a 2022 statement to VICE for an article titled ""Trump-Endorsed Candidate JD Vance Once Said Trump Might Be 'America's Hitler',"" a campaign manager for Vance said:
It's laughable that the media treats JD not liking Trump 6 years ago as some sort of breaking news, when they've already covered it to death since this race began. Clearly, President Trump trusts that JD is a genuine convert, as out of all the Republican candidates running, he endorsed JD and concluded that he is the strongest America First conservative in the race. … Despite the leftwing media's obsession with this old news, JD is proud to have President Trump's support and will stand with him to fight back against the radical left and the establishment RINOs as Ohio's next Senator.
In July 2024, after Trump announced Vance as his vice presidential nominee, various reputable news outlets, such asReuters, theBBCandThe Guardian, cited the 2016 text message again.
In a July 16, 2024,interview, Fox News' Sean Hannity asked Vance about his past comments about Trump, including the ""America's Hitler"" remark. Vance said ""I don't hide from that,"" in reference to his documented skepticism of Trump in the past. But, Vance said, Trump's time in the White House ""changed my mind"" (emphasis ours):
SEAN HANNITY: But you didn't have the nicest things to say about [Trump] back in 2016, which seems like a long while ago right now.You know, you literally said, you texted a friend that Trump was a cynical a**hole like Nixon who wouldn't be that bad and might even prove useful, and that he's America's Hitler.And you compared him to cultural heroin in the Atlantic monthly. And I'll tell you Trump's response, but you said that then. What do you say to people that say, ""Whoa, wait a minute. What did he mean?""
JD VANCE:Sean, I don't hide from that. I was certainly skeptical of Donald Trump in 2016, but President Trump was a great president and he changed my mind. I think he changed the minds of a lot Americans, because again, he delivered that peace and prosperity. If you go back to what I thought in 2016, another thing that was going on Sean is, I bought into the media's lies and distortions. I bought into this idea that somehow he was gonna be so different, a terrible threat to democracy.
McLaurin, who roomed with Vance when they were attending Yale Law School,wroteon X on July 15, 2024: ""I'm the guy JD Vance sent the 'America's Hitler' text to in 2016. He was my roommate in law school.""
He originally made the text messagepublicvia a different handle (@JoshforGeorgia), as seen via archived versions of that post (displayed below). McLaurin told us via email someone else began using that handle after he deactivated it, and he later started a new account (@JoshMcLaurinGA).
(archive.org)
We have alsoinvestigateda claim that Vance once posted: ""American hospitals are overwhelmed. It's time to take this seriously. As a start, let's fire thousands of nurses who refuse to get the vaccine. That will help."""
"“ICE will now become the country’s largest federal law enforcement agency, bigger than the FBI, bigger than the DEA.”",True,"As news of immigration raids permeate Americans’ social media feeds, news broadcasts and neighborhood meetings, critics of President Donald Trump’s tactics are warning his federal immigration force is gaining unprecedented strength.

Trump’s tax and spending law awards U.S. Immigration and Customs Enforcement, the federal agency charged with detaining and deporting people in the U.S. illegally, billions of dollars over the next four years.

""ICE will now become the country’s largest federal law enforcement agency, bigger than the FBI, bigger than the DEA,"" former Obama speechwriter Jon Favreau said on the July 8Pod Save Americapodcast he co-hosts.

Other left leaning groups and people have made similar statements, includingSen. Alex Padilla, D-Calif., theBrennan Center for Justice at NYU school of lawandAaron Reichlin-Melnick, senior fellow at the American Immigration Council, an immigrant advocacy group.

The new law clearly includes an enormous increase in spending for ICE, but does it make ICE the ""largest"" federal law enforcement agency? Favreau didn’t explain his metric for ""largest"" on the show, but he mentioned that the new law includes money to hire 10,000 ICE employees and build immigration detention beds.

We examined how ICE compares with the FBI and the U.S. Drug Enforcement Agency in terms of funding and staffing. Favreau is right about the DEA. As to the FBI, we found that Favreau’s statement tracks based on some calculations about spending in the new law and ICE’s likely annual budget. But it is less certain when comparing ICE and FBI staffing numbers.

Here’s a wrinkle in these comparisons: We don’t yet know the future years’ annual base budget for ICE or the FBI. Congress will set the fiscal 2026 base budgets by Sept. 30.

How ICE compares to the FBI in size is significant because it shows how federal officials are prioritizing the nation’s enforcement needs. The FBIinvestigatesa broad range of crimes including terrorism, cyber crimes, violent and white collar crime and although some of those offenders could be immigrants, it includes a lot of crime committed by U.S. citizens.

Several emails to Crooked Media, home of Pod Save America, did not get a response.

ICE is one ofnineagencies within the Department of Homeland Security — and it’s worth noting that DHS itselftouts on its websitethat all agencies combined make DHS ""the largest federal law enforcement agency with approximately 80,000 officers across nine agencies and offices.""

The law Trump signed provides about$165 billionfor Homeland Security, including $46.5 billion to finish building a wall along the U.S.-Mexico border. Its ICE-specific budgetary provisions add up to about $75 billion over four years.

The FBI and the DEA are part of theJustice Department. The DEA has a budget of about $2.6 billion and employsabout 10,000 peoplethroughout the world, making it easily smaller than both the FBI and ICE, no matter how you look at it.

Reichlin-Melnick told us he based his own ICE comparisons on funding.

""I’ve been saying that ICE will become the nation’s highest-funded federal law enforcement agency, with a budget larger than the combined budget of the FBI, ATF, DEA, U.S. Marshals Service, and Bureau of Prisons,"" Reichlin-Melnick wrote to PolitiFact.

Of the $75 billion going to ICE through September 2029, $45 billion is for 80,000 new detention beds. The remaining $30 billion will go toward hiring 10,000 new employees, removal operations and facility and information technology upgrades.

That works out to about $17.7 billion more per year through September 2029, bringing the total annual budget to about $27.7 billion. (ICE’s current annual budget is about $10 billion.)

That total amount for ICE adds up to more than the current annual budgets of the FBI, DEA and other law enforcement agencies including the Bureau of Prisons, according to theJustice Department.

If you look at the three agencies by staffing, the comparison is less certain.

As of April, the FBI had about38,000 employees,13,000of whom are special agents authorized to make arrests.

ICE has about20,000 employees, including6,100 deportation officers and 6,500 special agents authorized to make arrests. Under the new law, ICE’s force will grow to30,000 within four years — 10,000 of them officers, agents, investigators and support staff.

So although the FBI overall is larger than ICE now, ICE could surpass the FBI in the number of agents with authority to make arrests, depending on how hiring breaks down for the new 10,000  positions.

One caveat: ICE’s future annual budgets are unclear because the administration could spend the $75 billion sooner rather than later — meaning, not in equal measure across the four years, Migration Policy Institute spokesperson Michelle Mittelstadt said.

""Also, Congress is currently working on (fiscal year) 2026 appropriations, so they could change ICE’s annual budget then, too,"" Mittelstadt said.

The new law that Trump signed includes extra funding for ICE; it does not mention the annual base budget for ICE or the FBI for the next fiscal year, which starts Oct. 1.

Trump proposed that Congress provide$11.3 billionfor ICE, an increase over its current $10 billion. The FBI’s budget request is$10.1 billion; a reduction of $545 million and of at least 1,500 positions, including about 700 that are vacant, according to a JuneJustice Department budget and performance summary.

Other experts on ICE or the federal budget noted additional caveats.

John Sandweg, who served as acting director of ICE during part of Obama’s administration, told PolitiFact that more than one-third of ICE’s detention beds are operated by private prison companies.

""If you consider the guards and other facility personnel (most of whom technically work for the detention provider) as ICE employees, the agency is likely to be larger than the FBI,"" Sandweg said.

The Trump administration has also allowedfederal officials in other agencies, such as the DEA, the Bureau of Alcohol, Tobacco, Firearms and Explosives, and the U.S. Marshals Service to enforce immigration law.

ICE has hundreds of agreementsdelegatingsome immigration authorities to state and local police.

""None of those would be counted as personnel in the ICE budget justification, but it would vastly increase the number of law enforcement personnel acting on behalf of ICE,"" said Joshua Sewell, Taxpayers for Common Sense director of research and policy.

An example: Florida cooperates with ICE and in July opened Alligator Alcatraz, an immigration detention facility. The state will incur the upfront costs and seek reimbursement from the Federal Emergency Management Agency’s Shelter and Services Program.

RELATED:Fact-checking Trump at Florida’s Alligator Alcatraz about immigration, One Big Beautiful Bill

Favreau said, ""ICE will now become the country’s largest federal law enforcement agency, bigger than the FBI, bigger than the DEA.""

He’s right about ICE being bigger than DEA.

And ICE becomes the highest-funded federal law enforcement agency under Trump’s law compared with the FBI’s existing budget. But there are some unknowns: We don’t know if the $75 billion newly allocated to ICE will be spent evenly over four years or as a huge infusion in the first year, making the annual budget comparison  tricky. We also don’t know what will happen with the FBI’s annual budget over the next four years.

If the new ICE funds are allocated evenly over four years and based on current budget levels, that adds up to $27.7 billion annually for ICE, more than the FBI’s annual budget of about $10 billion and DEA’s $2.6 billion.

As to agency staffing, the FBI’s 38,000 workforce is greater than ICE’s 20,000 plus the expected 10,000 new hires. But ICE could surpass the FBI in the number of agents with authority to make arrests, depending on how the new hires shake out.

The statement is accurate but needs clarification or additional information. We rate it Mostly True.

RELATED:Permanent tax breaks for billionaires, temporary for everyone else? That’s exaggerated

RELATED:Trump says 'no tax on Social Security' with reconciliation bill. That's not true for everyone."
